id,category,prefix,firstName,lastName,position,department,address1,subdistrict,district,province,postalCode,active,createdAt,responsibleUnit,cooperativeType
KK001,สหกรณ์และกลุ่มเกษตรกร,นาย,ธนกฤต,ศรีสวัสดิ์,ประธานกรรมการ,สหกรณ์การเกษตรบ้านไผ่ จำกัด,109 หมู่ 2 ถนนมิตรภาพ,บ้านไผ่,บ้านไผ่,ขอนแก่น,40110,TRUE,,กสส.1,สหกรณ์การเกษตร
KK002,สหกรณ์และกลุ่มเกษตรกร,นางสาว,พิมพ์ชนก,คำแสน,ผู้จัดการ,สหกรณ์ออมทรัพย์ครูขอนแก่น จำกัด,62/18 ถนนประชาสโมสร,ในเมือง,เมืองขอนแก่น,ขอนแก่น,40000,TRUE,,กสส.2,สหกรณ์ออมทรัพย์
KK003,สหกรณ์และกลุ่มเกษตรกร,นาย,วรเมธ,ภูมิรักษ์,เลขานุการ,กลุ่มเกษตรกรทำนาหนองสองห้อง,221 หมู่ 16 ถนนเจนจบทิศ,หนองสองห้อง,หนองสองห้อง,ขอนแก่น,40190,TRUE,,กสส.3,กลุ่มเกษตรกร
KK004,หน่วยงานราชการ,,,,ผู้อำนวยการ,สำนักงานเกษตรจังหวัดขอนแก่น,ศาลากลางจังหวัดขอนแก่น,ในเมือง,เมืองขอนแก่น,ขอนแก่น,40000,TRUE,,,
KK005,ภาคเอกชน,นาย,ปกรณ์,สินธุวงศ์,กรรมการผู้จัดการ,บริษัทตัวอย่างขอนแก่น จำกัด,81 หมู่ 5 ถนนมิตรภาพ,สำราญ,เมืองขอนแก่น,ขอนแก่น,40000,TRUE,,,
KK006,บุคคล,นางสาว,ชลธิชา,วงศ์คำ,,,174 หมู่ 3,น้ำพอง,น้ำพอง,ขอนแก่น,40140,TRUE,,,
